,punctuated transcripts,sentences,nouns
15,"[Music]. space to attack on this near side goes for it too. good, turn the pace, cut back's a good one. but yeah, the left foot, good, take by pacheco. first chance of the game and this was good. builder, play down this near side machine looks a little concerned. it was hodder militator who was done for base from side last campaign, picked up from. uh, that's great ball into the box this and roberto is. beth wants a penalty and that looks like it has been given. it is indeed what. perez with the shots. he's gone to ground under the attentions of el yamic. well, the left hand of nat shop used to have uh, put lucas perry for el yamic. yeah, it's explaining the decision and he's given a red card. well, that's what it's about. he's thrown goal, oh, the stats tell us. and pereth has put the last three away, and this time he hits the bar. it's ricocheted back off the woodwork and lucas perez scouring drought goes on. there's a follow-up header from joselu. it's into the gloves. here is pereth. that's a neat touch to reuben. this is goddamn cross goal, lucas. and this time he started tremendous bully there from lucas parish theaters for the penalty miss with summer plum. well, how about that? the relief all round is evident for alabis. you talk about a scoring drought. well, that's one way to break it. it's hard to look up. perith is unmarked edge of the penalty area, swings the left foot and that is as sweet a volley as you'll see. lucas perez, rollercoaster. first half is very much now on the up. well, this should be called back then. if we're looking at that angle, there, kota is offside and this goal is chalked off, played in shorts. lucas perez- indeed, it is perhaps the best move of the game- gets the breakthrough for alamus. delightfully side-footed shot into the corner and the roof of the violin. ned roberto is beaten and the visitors at last get that breakthrough. well, work, ball on the far side. uh, salivas, move the ball up field. it was hotter into lucas perez. that is great vision from the alabas number seven. hotter two with ice in the back of his head, picked out thomas pina and going into this game. they had failed to take any points from all four games that they conceded first. they have got one hill up. here might be two beneath to nine again. and what does lucas perith have to do to score a goal for olives? brilliant clearance from el yamic. the ball through from hodder is delicious, increasingly influential as the second half goes on. he waved on martin is still full of running. martine in behind garcia carnero. time to pick a player out. it's into davison and parker is offside. it's his second touch. it was davison's shots. we'll see now if it was goal bound. well, surely that's garcia canelo playing burka sanchon and for my money that goal will count. there's the ball in from the sub martine. he's only been on the on the field of minutes. the advancing poker signs: two, all three substitutes involved in the build-up. the last touch comes from parker sanchez and from that what we're seeing there working out the angles, the goal is given. there it is. it's two nil to alabas. you can hear the celebrations, machine substitutes come up, trumps and absolute delight for alaves. they're well on the way to getting the first away win of the season and surely it is show over for real by the lead. well, that ball was going wide, wasn't it? in the right place at the right time. you can see that it's all over there in the rain at the jose ria in this crucial relegation clash, and it's alabas. you take the three [Music] points.","[('pace', 'one'), ('it', 'hodder'), ('who', 'base'), ('that', 'ball'), ('it', 'what'), ('he', 'attentions'), ('it', 'decision'), ('he', 'card'), ('that', 'what'), ('he', 'goal'), ('it', 'woodwork'), ('there', 'header'), ('it', 'gloves'), ('that', 'touch'), ('this', 'goddamn'), ('relief', 'alabis'), ('that', 'way'), ('perith', 'edge'), ('that', 'volley'), ('half', 'up'), ('kota', 'goal'), ('goal', 'shorts'), ('it', 'move'), ('roberto', 'visitors'), ('it', 'lucas'), ('that', 'vision'), ('hodder', 'half'), ('it', 'davison'), ('it', 'his'), ('it', 'davison'), ('davison', 'shots'), ('it', 'goal'), ('that', 'garcia'), ('there', 'ball'), ('he', 'the'), ('it', 'nil'), ('it', 'lead'), ('ball', 'it'), ('it', 'rain'), ('it', 'alabas')]","[[pace, ,, cut, back, 's, a, good, one], [it, was, hodder], [who, was, done, for, base], [that, 's, great, ball], [it, is, indeed, what], [he, 's, gone, to, ground, under, the, attentions], [it, 's, explaining, the, decision], [he, 's, given, a, red, card], [that, 's, what], [he, 's, thrown, goal], [it, 's, ricocheted, back, off, the, woodwork], [there, 's, a, follow, -, up, header], [it, 's, into, the, gloves], [that, 's, a, neat, touch], [this, is, goddamn], [relief, all, round, is, evident, for, alabis], [that, 's, one, way], [perith, is, unmarked, edge], [that, is, as, sweet, a, volley], [half, is, very, much, now, on, the, up], [kota, is, offside, and, this, goal], [goal, is, chalked, off, ,, played, in, shorts], [it, is, perhaps, the, best, move], [roberto, is, beaten, and, the, visitors], [it, was, hotter, into, lucas], [that, is, great, vision], [hodder, is, delicious, ,, increasingly, influential, as, the, second, half], [it, 's, into, davison], [it, 's, his], [it, was, davison], [davison, 's, shots], [it, was, goal], [that, 's, garcia], [there, 's, the, ball], [he, 's, only, been, on, the], [it, 's, two, nil], [it, is, show, over, for, real, by, the, lead], [ball, was, going, wide, ,, was, n't, it], [it, 's, all, over, there, in, the, rain], [it, 's, alabas]]"
16,"real madrid ready to start with the ball and it is rolling in the clasico phil shane alongside ray hudson- yeah, i didn't have such a good game in the champions league, much rather poor, and it's a bit of a surprise inclusion. but sedan's full of surprises. the managers give us so many great memories in the classical. look at it forward. valverde shot over the fingertips of neto and less than five minutes in, benzema provides and the gerua scores a wonderful turn and we've seen these chances missed many, many times. but he's got an eye for goal. like the cyclops starts it. there's that lovely turn. now he's taking everything into account on the run. it's a lovely, delicate touch and the delicacy of benzema's pass right there allows valverde the luxury of one little drip of honey on the ball and then the catapult home. a dream start for real madrid. phil sedan has mixed and matched. all season long he's been looking for that balance. he's tried to rest players that have been running to the ground. look out, nice chance for alba squares and there is 40 in the middle throwing his spear to the net. i knew there'd be gauze in this game and it's off. and he is under this like dracula under a plate of liver. beautiful ball over the top. beautiful lead again. mercy starts it as a dream ball for jody albert. the ball is so waited to perfection. jordy's just got to look along square man running and he kisses this one home suffers a mother's kiss at bedtime. it's a brilliant ball over the top. inside desk. the americans first charge forward. he'll pass it off for coutinho. coutinho spots a gap, but a one hopper to the chest of courtois. good play by the dutchman. messi finds a gap, fatih drops it back, tripped up edge of the area but cross got ball. i think that was a correct call. i haven't seen it yet, but i don't think leo's got too much. beautiful integration again there between him and the new center forward. and some fatty magic eludes casamiro, launches the shot, hit as he shoots. it's a save by courtois, but messi's still down potty with coutinho bendy over wide for the brazilian real is back lifted. messi is he on? ramos says no, messi says thank you, but courtois says not. today again, tremendous play by anzu fatty head. options left and right motoring, gets there early, dish benzema and down he's goes, world-class defender in his deer. so the defensive duties for barcelona should be able to be put right by him not a nice run out wide right waiting for the trailing run, throws the defense and almost darts it to the corner. spets looked right but finds messi outside of the boot for pedry. a little quieter in the second half for the 17 year old. here's dest fonte flag stays down, chipped across. coutinho spotted the corner but it flashes wide for the recovering mark andre terstage. ball launched to the six, carries through everyone. ramos thinks he was impeded. the referee disagrees, but the video review is going to take a look. juan martinez, who has seen the ball come back and he's trying to get back to the ball and the shirt pull is in certainly impeding the player. here's the call: the referee throwing a yellow to long lay. the video review says penalty for real madrid. one penalty chance earlier this year and converted. he's looking for his second and he sneaks it under the arms of neto and real madrid's in front. [Applause]. debatable penalty kick that we think probably gets the rate call. if it happens at the other end, i think it would have been given as well. [Applause]. as he goes short this time. coutinho for alba. messi shows alba runs, gets it back around ascencio across the six loose. coutinho can't get the first shot. looks like it's off the arm which was away from the body. var will take a look, but the referee says no, the var penalty ball inside, slapped away, mission impossible. this since may of 18 off but on. and he'll have to settle for the corner after absorbing barcelona's possession and standing staunchly in front of them with no threat. and now it's shifting across. another chance for cross and neto to the rescue twice. good work by vasquez. when they have come out of the long grass field they have looked very shocked. from the corner, pk, in the way up, steps vasquez wins it off, alba chip across, met by ramos, cleared off the line by neto and the rebound from casamito goes wide. a wonderful play, ronald gorman, to solve as the continuing disappointment of griezmann plays out. but i'll tell you what i have to keep going back to that. well, magic nice by modric, quick by vinicius. neto gets to block but it falls for rodrigo. out to modric who calmly sticks the dagger home. fabulous play from lucca. the creation is spelled by me here, twisting and turning like an alligator with an itch, and he detonates this one again. a mess of barcelona. in this second half, luca comes in and shows how unpredictably beautiful he can be with his football, he's got options. he says: i see you guys, i don't need you. the leadership of ramos coming to full brightness as well. the captain returns and the captain inspires for real madrid in a fair win, in a wonderful first half. classical, no answers for ronald coleman and barcelona. you.","[('it', 'clasico'), ('it', 'bit'), ('sedan', 'surprises'), ('he', 'eye'), ('there', 'turn'), ('he', 'everything'), ('it', 'touch'), ('benzema', 'pass'), ('he', 'balance'), ('he', 'players'), ('there', 'middle'), ('he', 'this'), ('ball', 'perfection'), ('jordy', 'man'), ('mother', 'kiss'), ('it', 'ball'), ('that', 'call'), ('it', 'save'), ('messi', 'coutinho'), ('messi', 'he'), ('he', 'goes'), ('review', 'look'), ('he', 'ball'), ('pull', 'player'), ('he', 'his'), ('madrid', 'front'), ('it', 'arm'), ('which', 'body'), ('barcelona', 'possession'), ('creation', 'me'), ('he', 'options')]","[[it, is, rolling, in, the, clasico], [it, 's, a, bit], [sedan, 's, full, of, surprises], [he, 's, got, an, eye], [there, 's, that, lovely, turn], [he, 's, taking, everything], [it, 's, a, lovely, ,, delicate, touch], [benzema, 's, pass], [he, 's, been, looking, for, that, balance], [he, 's, tried, to, rest, players], [there, is, 40, in, the, middle], [he, is, under, this], [ball, is, so, waited, to, perfection], [jordy, 's, just, got, to, look, along, square, man], [mother, 's, kiss], [it, 's, a, brilliant, ball], [that, was, a, correct, call], [it, 's, a, save], [messi, 's, still, down, potty, with, coutinho], [messi, is, he], [he, 's, goes], [review, is, going, to, take, a, look], [he, 's, trying, to, get, back, to, the, ball], [pull, is, in, certainly, impeding, the, player], [he, 's, looking, for, his], [madrid, 's, in, front], [it, 's, off, the, arm], [which, was, away, from, the, body], [barcelona, 's, possession], [creation, is, spelled, by, me], [he, 's, got, options]]"
17,"well, the two teams emerged from the tunnel. this match day five contest about to get underway on a sunny afternoon in valladolid, rodriguez worked inside here. a shot could be on a descent from distance. here comes the corner from her. suarez delivered just about clear [Applause]. well, the decision is a penalty in a bar's favor. takes a long run up for the penalty. blast that one. in no mistake this time around about score from the penalty spot. they take a one-nil lead ahead of the half-hour mark. well, dispatched by the argentine, esteban rodrigo burgos, along from roberto jimenez. nice pass over to the left-hand side. guardiola's going into the box here. this one's set up for a shot. there's the equalizer turned in on the slide and it's tony via suarez who scores a full stretch, able to turn the ball in off the post. and just minutes after the a bar opener comes the violin equalizer, orianna, taking no chances there, avoiding a quick throw. here's a nui across the near post. roberto jimenez makes the save. he's back on the ball here playing it from the ground. he's still going and he's dipping into his box of tricks there and the referee has awarded a spot kick in vitally's favor. just after the restart, it's the tricky tony via suarez who, dipping back and forth on the edge of the area and guardiola, has it saved by dimitrovic. the follow-up goes out for a corner, helped on its way to the left-hand side. kiki garcia looks right at the near post. it's too long for him back to diop, who tried to shield the ball. i'll have to be careful because he has already been booked and it's going to be a red card for puppet yap. [Applause]. he is sent off for a challenge on kiki perez. there's a little bit of afters as well, from takenui, who bumped into the referee as he tried to plead the case for his teammate. here comes the free kick, but low. jimenez makes another save. albia makes his way down the left, gets across into the center and there is the winning goal from kevin rodriguez. [Applause]. doubles back on the defender, wrong foots him, keeps the ball in play. the cross in from the left is hit with pinpoint precision and the header from rodriguez gets the better of the defender, gets the better of the goalkeeper and seemingly gets a bar. their first three points of the season. [Music] you.","[('decision', 'penalty'), ('bar', 'favor'), ('guardiola', 'box'), ('one', 'shot'), ('there', 'equalizer'), ('it', 'suarez'), ('he', 'ball'), ('he', 'he'), ('he', 'his'), ('vitally', 'favor'), ('it', 'tony'), ('it', 'him'), ('it', 'card'), ('he', 'challenge'), ('there', 'bit'), ('there', 'goal'), ('left', 'pinpoint')]","[[decision, is, a, penalty], [bar, 's, favor], [guardiola, 's, going, into, the, box], [one, 's, set, up, for, a, shot], [there, 's, the, equalizer], [it, 's, tony, via, suarez], [he, 's, back, on, the, ball], [he, 's, still, going, and, he], [he, 's, dipping, into, his], [vitally, 's, favor], [it, 's, the, tricky, tony], [it, 's, too, long, for, him], [it, 's, going, to, be, a, red, card], [he, is, sent, off, for, a, challenge], [there, 's, a, little, bit], [there, is, the, winning, goal], [left, is, hit, with, pinpoint]]"
18,"what i love about, um, football, uh, more than anything, is the, the, the sheer fun that it has brought in my life, and as a player, as a coach and now as a commentator. uh, it just fills me with, with, with pure joy. there's sad times as well, uh, which is all part of the human, uh spirit, which is okay and and take that, but it, it has this amazing ability to provide us with the promise of magic. uh, how many things in your life can you say that about this? you know this sport- and you could argue that all sports do, if you, if you're that way inclined into that particular- but nothing does it like football and the unpredictability of it, the romance of 11 players going out there to play another 11, uh, that can cause such upsets, such staggering, unbelievable results. um, they'll never, will never, solve this game. we think we know football, we don't know football, nobody knows it. pep, guardiola, zidane, mourinho, they're still searching for what x equals. nobody, ever will you know. in that that part of it for me, is part of the beginning bewitching magic of football, not just one little thing, it's the overall scope of the game. it puts its fish hooks in your heart and it drags it up and puts it in your mouth and it all comes out beautiful. love it like the first time, only on being sports you.","[('anything', 'fun'), ('there', 'times'), ('which', 'all'), ('which', 'that'), ('me', 'part'), ('it', 'scope')]","[[anything, ,, is, the, ,, the, ,, the, sheer, fun], [there, 's, sad, times], [which, is, all], [which, is, okay, and, and, take, that], [me, ,, is, part], [it, 's, the, overall, scope]]"
19,"um, the- the- my favorite being sports re-aired football game- was, uh, the barcelona game, uh, against real madrid at the santiago bernabeu, and i think it was 2015 where it was, uh, the most astonishing display by barcelona. and it wasn't just because it was barcelona, it was the manner of their football, that the brand of their football, playing up against the really good real madrid team where cristiano was, it is, it is hate. and messi didn't play. messi didn't start the game. it was iniesta who was this wonderful dictator, and i watched that game over and over and every time i get the opportunity- actually, i've got to admit i have it on dvd because it's such a work of footballing beauty. it was lucia enrique team as well, and he got the best out of them that day, but none more so other than than andres iniesta, who got a standing ovation as he walked off the field, and it was, it was one of those performances. this is one of those moments. i'm choking up now, listening to this myself and remembering that moment, because, uh and yes, that showed just a level of performance that was just staggering, and all credit to the, to the bernabeu, to the madridistas who stood up and said: we applaud you, love it like the first time only on being sports.","[('game-', 'barcelona'), ('it', 'it'), ('it', 'display'), ('it', 'it'), ('it', 'barcelona'), ('it', 'manner'), ('cristiano', 'it'), ('it', 'it'), ('it', 'iniesta'), ('who', 'dictator'), ('it', 'work'), ('it', 'lucia'), ('it', 'it'), ('it', 'performances'), ('this', 'moments'), ('that', 'credit')]","[[game-, was, ,, uh, ,, the, barcelona], [it, was, 2015, where, it], [it, was, ,, uh, ,, the, most, astonishing, display], [it, was, n't, just, because, it], [it, was, barcelona], [it, was, the, manner], [cristiano, was, ,, it], [it, is, ,, it], [it, was, iniesta], [who, was, this, wonderful, dictator], [it, 's, such, a, work], [it, was, lucia], [it, was, ,, it], [it, was, one, of, those, performances], [this, is, one, of, those, moments], [that, was, just, staggering, ,, and, all, credit]]"
20,"uh the commentary in a game in 2013, uh, with barcelona against athletic club d bilbao, where mess it wasn't the goal that he scored a couple of years later, in 2015, when he slalomed through uh players over space. that, for me, wasn't the genius of messi. the genius of it for me was that game against athletic club at the old san mames, where he throws players. he froze them three, four, five, and my commentary uh in that game, i thought, did justice uh to his uh, true, utter, alien-like genius. um, we put four players inside a television box and he didn't care. he waltz through them. he virtually tapped them on the head and gave them pieces of chocolate in the hat in the mouths uh, as he went by them. and then he just had to beat the goalkeeper from uh outside the 18 yard box, uh through different players as well. he had to pick a postage stamp in the bottom right hand corner and he did. it was a. it was the art of slow. this wasn't speed, step messy going through space. uh, slalom runs through players over distance. this is where he took it all into account and and slowed the game down and as the players dived in and chomped at him, he emasculated them and, as i said in the commentary, in that game he disposed his atoms on one side of the defender and collected them on the other before he struck the ball home. that, for me, was uh, was, was, was, was, was. again, nobody else in the world from the greatest ever, lionel messi. love it like the first time, only on being sports.","[('it', 'goal'), ('me', 'genius'), ('me', 'game'), ('it', 'a.'), ('it', 'art'), ('this', 'speed'), ('this', 'he')]","[[it, was, n't, the, goal], [me, ,, was, n't, the, genius], [me, was, that, game], [it, was, a.], [it, was, the, art], [this, was, n't, speed], [this, is, where, he]]"
