,punctuated transcripts,sentences,nouns
0,"this is a wonderful show of class from hetafa as they applaud the quote by del rio winners [Applause] the guard of honor, nice. and it has been controversial with certain madrid teams doing that for barcelona. but itafe has a couple of farsa players of their own, one way threading it into that inner channel, knotted away by iglesias and suarez, trying to collapse. messi at the top of the 18, off the underside of the crossbar and somehow it didn't go in. brilliant from antoine griezmann, beautiful streak and again messi blissed as the crossbar and raises blisters on that solid steel. it's a wonderful setup from antoine griezmann that you don't get a good look at here and that's very close. threads it, but needed more on it. no chance for iglesias, who's been a bit adventurous. now down the other way, as messi sounds to the inside. dakom tries to push him off but he just gets him that much closer to goal. magisterial from lionel: again astonishing straight. but what a ball from sergio busquets. the finish is stupefyingly magnificent. messi, quicker than a jack rabbit on a hot, did under this visionary pass from busy. he turns, he looks, he's already identified it and it looks as if he's on side. that is certainly on side. a wonderful, divine combination between bousquets and messi, and that divine combination from lionel, that the vain combination and connection of his eyes to his brain, to his footballing feet. again, epinephrine, in football, footsville, you want to see what pure adrenaline looks like. you just saw it. you just saw what the invisible man looks like. leonel, wonderful strike. what a ball from sergey busquets. and we look at it again. see it, man. dr einstein called it the spooky action over distance. he was thinking about busquets and messi, i'm sure, and with that in mind, ball inside kubo slashing through, but he can't caress it past terestagin appealing for a corner and he's not going to get it in. they're in javi, of course, but they're, they're on a different frequency and they both understand it- like two chattering dolphins. kubo keeps it alive, sergio roberto has dropped into oscar's gap and that means de yong has had to cover ball back wide, for cucurella whips it inside, angel gets a little pinballing help as he wizards home an equalizer- well missing, that wade man here now, and hitachi make them pay for it- who does brilliantly well, and it's a fortunate hit home from angel. certainly, longleaf comes across and gets a piece of it, but it's cucarella who was just said phil in the preview. he's got a point to prove. he never played for barcelona, but he has a give, go and get and a beautiful cutback to thank cucaraya from. and then this wonderful intentional ball is stabbed. it probably would have been heading wade, let's take a look from this angle. but it comes off lung layer and that's probably going to go down as an own goal. but credit to google and credit to angel who just manages to make things happen. 1-1 the score, 1-1 all inside from roberto griezmann wide for messi, who's coming a bit deeper today. back to messi, who caught all of that one, maybe a little too much, again starts out wade with antoine griezmann, who's got his footballing boots on the right feet here today, finds its way across. messi finds him beautifully, the way only leo can, so quick with the dispatch. jordy feeds him back a hopping ball who would probably almost be ever present if he hadn't gotten hurt through ball for de young. sergio. roberto doesn't give up on it though. suarez young with a touch, messi with the side volley, copa del rey under his belt- still a chance for a league crown. has it been a successful debut for coleman? i think he's been incredible on how he's pulled humpty dumpty back together again, phil, because it was a bit of a mess in the early going and he had a multitude of injuries and touched back, and that one might and does miscommunication, screaming at saudia for not screaming. he was coming out and barcelona, who had given a gift, gets one back now. comedy of eras at the back between chaka and zarya, and leo capitalizes as only he can. but take a look at this. it's one of those things. and the shaking of the heads doesn't really do it. the coaches got no idea what happened, just a ball, and this should easily been taken care of, but chaka steers it past. it's got to be down to chaka here. it's nothing to do with the goalkeeper. i mean, if you're going to play it back, you've got to put a weight of the goal posts and as soon as it's released you can see that it's heading in the wrong direction, unless you're already recognizing this is a goal and it's an absolutely catastrophic touch by watchaka. and you can see saudi arabia talking to me. messi punched away by the hitake keeper. the young, upended griezmann can't control roberto, but he doesn't get it all poor touch maksimovich back into the 18. messi on the valley and it slapped off the post. but on the second try he pulls a rabbit out of his hat. well, again it's the odd- using the upright as his reference point and plays a one-two off of it. amazing from messi, [Applause], wonderful balance from him to readjust his second shot. and again, slippery, other than an ice cube on an oven top. take a look, again it's not cleared. well, worn upstairs. there's the first shot. he follows on and the angle is actually narrower in this halo of a footballer, again tonight's looking like a shark that's been in a fish tank for a week. phil, he is really up for this game. it's a beautiful little touch save by david sauria, but the footballing gods flash their blow. grana eyelashes at leo and he skips the late. fantastic, with a bit of fandango thrown in for good measure: 40 yards out from dead center, sweeping it far side over saudia, but busquets couldn't get there in time. five minutes into the second half, all chipped in, the header just goes wide. good chance for chocolate to rip off the goat horns into the area. down goes mata, and it's actually anna's- unallen appeals for a penalty. the referee figueroa appears to see nothing. and now, with unall down [Applause] and var is going to say: it's worth taking a look, and they have to be pretty positive if they're going to stop the run of play. take another look here. ronald araujo, arms in the air, but it's what his feet were doing. what do you think, ray? just contact me at phil and it's balls under control and apparently it is. yeah, good hold of a player by nsu. now there's a ball, it's harsh, but no ideas. we keep on seeing this. this penalty box is now becoming a real jeopardy box. in many ways, barcelona's net minders haven't had much success. stopping from the spot, curls around, now strikes and rolls it into the empty corner as terstegan goes the other way and barcelona's lead cut in half. [Applause] being that sort of game that barcelona haven't been able to create a multitude of chances at the other end, despite all of their possession. it's a perfect penalty, sending to stage in the wrong way and very cool with the dispatch. beautiful, here's messi on this restart kubo, the only man in the wall, five minutes left in regulation curling ball, headed high by dakonam and out for the corner, counted on in all of the games, for all of the minutes. messi looking near post and it's a glancing header by araujo who makes up for his penalty foul thanks to lionel messi and a perfect pass. zoom lenses for eyes, messy. it's a beautiful set-piece goal for barcelona that puts the barcelona faithful into the in in relax mood. the beautiful header from aroha in an absolutely exquisite free kick, messy, as always, fire on ice. and it's a wonderful glancing header from a rojo. it's as cool as an arctic place down your shorts. lovely leap to meet it, the sweetest of glances. it's a great dynamic, isn't it? wonderful leap up first time. they've scored more than a goal since february through ball de yong. and it's messy with the right. just high. [Applause]. basement: messi kissed up. griezmann tries to catch it. the referee calls this one a foul. var will have to confirm it. but the gift that was given now taken away, as griezmann earns a chance from the spot again. when the start of this game he and messi were playing some scintillating rat attack football. and here again the combination: in a very tight space, sophian comes through and kicks through the back again in the penalty box. it's always going to be given. he comes through and gets enough of griezmann, idiot a lot. but it's enough for the referee and a chance to sneak one home, the fifth from griezmann, a picture perfect penalty. well, the score lane will say 5-2. and it has been a wacky game. we've seen all sorts of beautiful goals and absolutely claws that they've got a look at the witch's nose with warts on it. but griezmann earned this penalty kick and messi extends the gratitude. it's a wonderful strike into the bottom corner from antoinette. so the final whistle while we watch griezmann from the spot. now, two for three from 12 paces for the frenchman has barcelona challenged but responds well, incredible game and more wisdom. one and a lot to digest and discuss. and well, leo messi gets king of the match for the king of the beers again, and less than super messy, but more than enough to be the inspiration you.","[('this', 'show'), ('it', 'setup'), ('who', 'bit'), ('he', 'it'), ('he', 'side'), ('that', 'side'), ('he', 'busquets'), ('he', 'it'), ('oscar', 'gap'), ('it', 'hit'), ('it', 'cucarella'), ('who', 'phil'), ('he', 'point'), ('that', 'goal'), ('who', 'bit'), ('who', 'his'), ('he', 'he'), ('he', 'phil'), ('it', 'bit'), ('he', 'barcelona'), ('it', 'things'), ('it', 'chaka'), ('it', 'nothing'), ('it', 'you'), ('it', 'direction'), ('this', 'goal'), ('it', 'touch'), ('it', 'upright'), ('there', 'shot'), ('angle', 'halo'), ('tonight', 'shark'), ('that', 'fish'), ('he', 'game'), ('it', 'touch'), ('it', ""anna's-""), ('var', 'it'), ('it', 'look'), ('it', 'what'), ('it', 'balls'), ('there', 'ball'), ('it', 'ideas'), ('box', 'jeopardy'), ('barcelona', 'minders'), ('barcelona', 'lead'), ('it', 'penalty'), ('it', 'header'), ('it', 'piece'), ('it', 'header'), ('it', 'place'), ('it', 'dynamic'), ('dynamic', 'it'), ('it', 'right'), ('that', 'griezmann'), ('it', 'referee'), ('witch', 'nose'), ('it', 'strike')]","[[this, is, a, wonderful, show], [it, 's, a, wonderful, setup], [who, 's, been, a, bit], [he, 's, already, identified, it], [he, 's, on, side], [that, is, certainly, on, side], [he, was, thinking, about, busquets], [he, 's, not, going, to, get, it], [oscar, 's, gap], [it, 's, a, fortunate, hit], [it, 's, cucarella], [who, was, just, said, phil], [he, 's, got, a, point], [that, 's, probably, going, to, go, down, as, an, own, goal], [who, 's, coming, a, bit], [who, 's, got, his], [he, 's, been, incredible, on, how, he], [he, 's, pulled, humpty, dumpty, back, together, again, ,, phil], [it, was, a, bit], [he, was, coming, out, and, barcelona], [it, 's, one, of, those, things], [it, 's, got, to, be, down, to, chaka], [it, 's, nothing], [it, 's, released, you], [it, 's, heading, in, the, wrong, direction], [this, is, a, goal], [it, 's, an, absolutely, catastrophic, touch], [it, 's, the, odd-, using, the, upright], [there, 's, the, first, shot], [angle, is, actually, narrower, in, this, halo], [tonight, 's, looking, like, a, shark], [that, 's, been, in, a, fish], [he, is, really, up, for, this, game], [it, 's, a, beautiful, little, touch], [it, 's, actually, anna's-], [var, is, going, to, say, :, it], [it, 's, worth, taking, a, look], [it, 's, what], [it, 's, balls], [there, 's, a, ball], [it, 's, harsh, ,, but, no, ideas], [box, is, now, becoming, a, real, jeopardy], [barcelona, 's, net, minders], [barcelona, 's, lead], [it, 's, a, perfect, penalty], [it, 's, a, glancing, header], [it, 's, a, beautiful, set, -, piece], [it, 's, a, wonderful, glancing, header], [it, 's, as, cool, as, an, arctic, place], [it, 's, a, great, dynamic], [dynamic, ,, is, n't, it], [it, 's, messy, with, the, right], [that, was, given, now, taken, away, ,, as, griezmann], [it, 's, enough, for, the, referee], [witch, 's, nose], [it, 's, a, wonderful, strike]]"
1,"[Music] vasquez, bursting up the right wing, sneaks it into the sixth. the heel flick for benzema and the drought is over. and reality, the magisterial goal from the royal weights. this and it goes all the way back. it's a wonderful run, passed by verdi, beautiful ball, but benzema absolutely pulls a peacock out of his hat. it's magic, majestic finish from kareem who again rises to the top. a dana made finish. it's a wonderful run. there's the dripping of the honey and a brilliant pullback for developing, nicely covered up by natural. it's good. defending by the swiss army knife of real madrid. he's been at the club since he was in diapers. really i think this one's just outside, but it's a brilliant run. wonderful squirrel on a telephone wire. he freezes around, he goes in between the two of them. it's just outside of the box, 22 meters, about 23 yards away. the german sweeps it in deflected and it nestles in the back of the net. real madrid, emphatically, with a two, nothing first half lead iman absolutely out of his skin as he approaches the panel of his career, the world cup winner. he's got zoom lenses for eyes here. link's eye vision from tony. take a look from this angle. there's the clip for home. from this angle. here you'll see. sergino dez turns his back, commits the cardinals in phil, the young american jumps and turns his back away here he stands up in front of it and lets it hit him. it will probably not get that sort of wicked deflection on the outside. help across and james valverde shoots are outpost rebound. vasquez and ter stegen to the rescue. fabulous play again by real madrid. off like a jack rabbit on a hot date as the whites break and absolutely stretch out barcelona like spandex on miami beach. masterpiece of team football. really was exceptional in the finnish. [Applause]. [Music]: his second goal as a barcelona player controls that one past courtois and we've got ourselves a game. well, the game's back on now and it's probably the best passenger played by barcelona all game long. it finds its way through just past casemiro- nobody's following mengisa, a disney ball in the traffic looking for griezmann who has the wonderful uh ability and insight to just take it into consideration. dummy over the ball and it finds its way through to the defender, mengiasa, whose finish is good enough and brings his team back into the gift trying pam ascencio for benzema, but vinicius in the way cross denied on the block their training ground. but they have upgraded it quite a bit. ball is snapped down by elish moriba. but courtois was ready, does everything he can, gets above the ball, hammers it down and just doesn't get an angle of this slick, greasy surface to take it past. again, parson with a main advantage. elish tries to step into it. yeah, rush of blood, this time from a wonderful young player who's learning on the job. but decisions made in a blink of a bee's eye by young elijah. he goes the wrong way. a night like this, a strange classical in every way, shape and form, fill with that. opening goal for real madrid has been the highlight last ditch saloon for bossa. there's stegan charging up field, headed in the crossbar to stagan and it bangs off of king cow. the rebound shot sails high. oh, what a goal that would have been. and that's gonna do it late. heroics cannot save marsa: 2-1 real madrid.","[('it', 'run'), ('it', 'finish'), ('it', 'run'), ('there', 'dripping'), ('he', 'club'), ('he', 'diapers'), ('one', 'it'), ('it', 'run'), ('it', 'box'), ('he', 'zoom'), ('link', 'eye'), ('there', 'clip'), ('game', 'it'), ('it', 'passenger'), ('nobody', 'mengisa'), ('finish', 'his'), ('ball', 'moriba'), ('courtois', 'everything'), ('who', 'job'), ('bee', 'eye'), ('there', 'stegan'), ('that', 'it')]","[[it, 's, a, wonderful, run], [it, 's, magic, ,, majestic, finish], [it, 's, a, wonderful, run], [there, 's, the, dripping], [he, 's, been, at, the, club], [he, was, in, diapers], [one, 's, just, outside, ,, but, it], [it, 's, a, brilliant, run], [it, 's, just, outside, of, the, box], [he, 's, got, zoom], [link, 's, eye], [there, 's, the, clip], [game, 's, back, on, now, and, it], [it, 's, probably, the, best, passenger], [nobody, 's, following, mengisa], [finish, is, good, enough, and, brings, his], [ball, is, snapped, down, by, elish, moriba], [courtois, was, ready, ,, does, everything], [who, 's, learning, on, the, job], [bee, 's, eye], [there, 's, stegan], [that, 's, gon, na, do, it]]"
