,punctuated transcripts,sentences,nouns
108,"Armenia asked me: who would you prefer, chameleon? I, Johnny Hernandez of the Magisterial Andrea Pirlo? this question made me feel a true sense of sadness, just reflecting on the fact that these to consummate cerebral dictators will no longer decorate European football stadiums with their Magisterial, world-class talent. MLS, of course, benefits regally by providing P law with a New York size challenge. well, the Qatar stars League extend JV and Oasis without sad. they were runners-up last year. man alive, how I'm gonna miss these. - brynee orchestrate a zombie in sports. how did I love them? I can't count the ways I love their syncopated Jamaican kettle drum rhythm setting stale. their languid elegance on the pitch loved it with the depth and breadth and hate that my footballing soul could reach with the breath, smiles and tears of all my life. apologies there, Elizabeth Barrett Browning, but she wouldn't mean she was a Geordie. they share such a rare grace, these two Oracle's of our game, these ball whisperers. it's a suave, sophisticated nature that is be stored upon them. footballs equivalent of x-ray vision, their fries free and their moments on the ball 100 times before selecting the pass, nearly always the genesis of a dangerous attack. bewitching is candle eight in their constant surveillance of the pitch, with necks like an owl and eyes of a tiger. these two could feign gaps in the scent of a rose. take your box, the box midfield, at leats and stickum, comparing chameleon eyes and pls peel with that tape as they comparing classic violinists with tambourine players for an exquisite 70 last minutes in the Champions League final. these two arrests, bottles of our game, played out their last dying breaths of European football on a stage befitting their majesty. how each of them ridged, raged against the dying of their late and they did not go quietly into that long good night. supreme clairvoyance of the midfield. both here were two Caesars. where comes such another?","[('she', 'Geordie'), ('Oracle', 'our'), ('it', 'suave'), ('that', 'them')]","[[she, was, a, Geordie], [Oracle, 's, of, our], [it, 's, a, suave], [that, is, be, stored, upon, them]]"
109,"Sean asked me rib, what two teams will make it to the fatal of corp america and who do you think will win it? well, roll up, roll up and get your seat belts tightened and your me. it's over for a good old corporate America barbecue that looks set to broil your nerves. the quarterfinals are set to rock and roll. brie of Jamaica, Venezuela, Ecuador and Mexico all give honorable and surprisingly enterprising performances before exiting, were left with the real class on the grass now and the pure excitement, the pressure and the expectations get ratcheted up. the horse nation, Chile, are playing with more personality than Mel Blanc and have a red carpet road to the Final. La Roja alfombra, that charu. as a rule, require just the tape of hard-nosed team to give Chile's alfombra a good cleaning the old-fashioned way by smacking it. but the Red Hot Chili Peppers came through through the fire and advance into the semi-finals now. well clear, Chile, Bolivia, Peru sets of two saves that got here by the skin of their teeth, surprisingly, but deservedly, saw, and fiat has cast them against each other now in a fair and square matchup: la Verde vs los Incas. that games going on right now as we speak. Brazil get Paraguay and donges men have shown steady progress. without the inspirational number 10. near mar, they'll be preparing for a tense game against the Paraguay side, who have unbearable hearts and a belief that there are the tournament's true dark horse. can the Kamerion was paralyzed, paraguayans tracy and knock three times quick. finally, Argentina, fierce up the World Cups. impressive performers, Colombia. but this edition of Los cafeterias have had more look than that frog who hopped across the highway. but now that they're here, look out Argentina. look like they're ready now to show their real tangle, stale after some awkward looking missteps in the lead-up to this. so now it's time, argentina, messy, show me your paso doble: chile vs argentina in the feiner. but it's Argentina. campeon has a Campione. sergeant enoch, comfy honest.","[('it', 'America'), ('Chile', 'alfombra'), ('tournament', 'horse'), ('Kamerion', 'paraguayans'), ('it', 'time'), ('it', 'Argentina')]","[[it, 's, over, for, a, good, old, corporate, America], [Chile, 's, alfombra], [tournament, 's, true, dark, horse], [Kamerion, was, paralyzed, ,, paraguayans], [it, 's, time], [it, 's, Argentina]]"
110,"Cameron and Edgar asked me, ray, what's wrong with Tata Martino and can messy lead Argentina to a copa amrica victory? hey, these two men are in the world spotlight again, an operating under serious pressure again and are being held to great expectations to keep getting better and raise their already impressive accomplishments ever higher. again, Martino's argentina played the best 45 minutes of football i've seen in that first half vs paraguay, with silky, stale and pizzazz leading to nothing, and they coulda shoulda doubled that lead. the second half was diametrically opposite and Martino's man eased up and paid the price. a lesson learned for the team and the coach. Tata's risky subs at 21 was criticized but the boss said: i won't change, we won't change, we'll kick. taken risks. well, don't tattle add. the Albiceleste is next game vs uruguay was ear torture test in the River Plate Derby. who? always a battle royal, this, and no place for choir boys. it lived up to the billing an. a fate where angels fear to tread. that has autistic players fear statue. a team that was harder than the Hammers of hell, but Martino's men never backed down, showing their guts and Mel in their brilliant football in fierce of a nasty match that I got sent off for protesting how his players were getting more. that'll only endear him more to his warriors. his captain, Messi, had to provide the standard, be the one to lead the way through this fair. he did not. his more scintillating much but a lead as performance. his unflinching courage to never hate seeing Rufus up, kick us all your Lake. we in backing down. this was no place for the faint-hearted of softies, and the captain stood up and took his licks and kept on with a grit that the churros would have respected. will it be enough to crown argentine corp a chance? well, we all know they're good enough technically. now we know they're tough enough mentally.","[('what', 'Tata'), ('Martino', 'argentina'), ('half', 'Martino'), ('Martino', 'man'), ('Tata', 'subs'), ('subs', 'boss'), ('Albiceleste', 'game'), ('uruguay', 'ear'), ('that', 'Hammers'), ('Martino', 'men'), ('this', 'place')]","[[what, 's, wrong, with, Tata], [Martino, 's, argentina], [half, was, diametrically, opposite, and, Martino], [Martino, 's, man], [Tata, 's, risky, subs], [subs, at, 21, was, criticized, but, the, boss], [Albiceleste, is, next, game], [uruguay, was, ear], [that, was, harder, than, the, Hammers], [Martino, 's, men], [this, was, no, place]]"
111,"pet or Torres Mendez actually read between the pet macias and dear Mooji, Buffon, hurry, admire most, Wow, the powers that be in heaven of football fans. we know that it's God's game. I'm pretty sure he wears a number 10 shirt, but sometimes he likes to slip into a goalkeepers jersey, as we used to all do his kids, and it probably has the names of Casillas a Buffon on the big man's back. my own admiration for them- both of them- is as high as Mount Olympus on Mars. look that thing up on your Google. ething. listen. we've been staggered by these goalkeepers, jaw-dropping magic, seemingly forever. even the three big weight skinny powers. the golf course seemed to perform better for them when eager and GG pushed the ball under the frame with their eyes. this is to a morgue or keep has cashed. in the Champions League semi-finals, both captain's bought world cup-winning Colossus. counting their trophies and individual awards is like counting sand on the beach. gianluigi buffon is known as Superman. he hangs kryptonite around opponents fleeing through a shot and he gets stronger. he's 37 now when he still as sharp as a port your pains bomb. his phenomenal leadership from the gore lane is world class. his acrobatics on the lane, just like iker casillas, are as agile as Nadia. common edge on a trampoline degree event is a Khan himself. CA said he'd be pissed off if he was subjected to the boos and whistles in. eka has enjoyed from a lot of real madrid so-called supporters. in that time eka has won even more trophies in LED los blancos to the Holy grille of la decima, and they still boo him. unconscionable stones a real madrid since he was 11 years old. his helo has slipped over his eyes a handful of times in those 25 years, but his Stardust on the lane covers the rear fallibilities. their clubs will never, ever see the lakes of them again, never. these are two players that are beyond magnificent. they are truly magisterial.","[('it', 'God'), ('God', 'game'), ('them-', 'Mount'), ('this', 'morgue'), ('captain', 'world'), ('awards', 'sand'), ('buffon', 'Superman'), ('he', 'he'), ('lane', 'world'), ('event', 'Khan'), ('he', 'boos'), ('he', 'years')]","[[it, 's, God], [God, 's, game], [them-, is, as, high, as, Mount], [this, is, to, a, morgue], [captain, 's, bought, world], [awards, is, like, counting, sand], [buffon, is, known, as, Superman], [he, 's, 37, now, when, he], [lane, is, world], [event, is, a, Khan], [he, was, subjected, to, the, boos], [he, was, 11, years]]"
112,"Ryan and Bill asked me: Rick, is this the best front three of Barcelona you've ever seen, and is this the best Barcelona team you've ever seen? now these questions come maybe a little bit too early, don't you think? lads with Barcelona are still having to secure any of the three-tails at the are in favourites position of winning and yet, understandably, people are legitimately wondering if they are witnessing something special here. the creme de la creme of Barcelona football- but not for me. so the answer is no, on both counts- is mesmerizingly glittering as this front three are playing. they still don't eclipse records at all: Omri and Messi, or especially Guardiola, as a message via in petal. but they occurred, oh yes, they occurred. the athleticism of that rake art said it was stupendous. and then that being changed with perhaps Quicksilver trio, Messi's genius, crucially pivotal in both editions, to such an extent that if Leo was removed, the symphony of football they created would be reduced to baa baa black sheep. Messi elevates an elevated. those players there were different dimension. he's doing it again. it's Neymar for me, who was still developing and maturing and has the scope and excellence to be similarly inspirational as Messi has been and possibly make this made in South America. try add, beyond special. but that team of Guardiola's, to my own eyes, will never be surpassed, and not just that front three of, via Pedro and leo. it was the goalkeeper, it was the defense, it was the midfield. and it wasn't scientific football, it wasn't even art, it was even more sublime, it was botanical. that team ruined football for me because it spoilt me entirely. how can you follow that? the trophy hall was staggering. the way they played football was ten times more impressive. no matter what statistical records this current front three of boss achieve in this bewitching development that we're all seeing of the latest edition of Barcelona football, and no matter how gorgeously engrossing this team is, for me the Guardiola model remains football's Nirvana: the beautiful games, uncomputable, operatic, highest nought.","[('Rick', 'this'), ('you', 'this'), ('answer', 'counts-'), ('Messi', 'genius'), ('Leo', 'symphony'), ('he', 'it'), ('it', 'Neymar'), ('who', 'scope'), ('Guardiola', 'my'), ('it', 'goalkeeper'), ('it', 'defense'), ('it', 'midfield'), ('it', 'football'), ('it', 'art'), ('it', 'it'), ('football', 'times'), ('team', 'me'), ('football', 'Nirvana')]","[[Rick, ,, is, this], [you, 've, ever, seen, ,, and, is, this], [answer, is, no, ,, on, both, counts-], [Messi, 's, genius], [Leo, was, removed, ,, the, symphony], [he, 's, doing, it], [it, 's, Neymar], [who, was, still, developing, and, maturing, and, has, the, scope], [Guardiola, 's, ,, to, my], [it, was, the, goalkeeper], [it, was, the, defense], [it, was, the, midfield], [it, was, n't, scientific, football], [it, was, n't, even, art], [it, was, even, more, sublime, ,, it], [football, was, ten, times], [team, is, ,, for, me], [football, 's, Nirvana]]"
113,"lionel richie idea. nobody ever asked me three. how can he say milan and india get back to their glory days? well, these are two world-class football clubs, institutions that were once footballs equivalent in Buckingham Palace, and nobody is the reduced to a far greater modesty. so how do you get back to the house on the hill? easy money when he solves everything in modern football? sad but true. look at the advances. PSG in manchester city of mid Chelsea- even I'd let it go- Madrid recently, new ownership revitalizes new money by success. all of the clubs are just mentioned, a proof. these new energetic owners are demanding much needed change in Italian football's very structure, the business plans and enterprise, because they see cultures worldwide appeal till here. once the football authorities in Italy to get with the times, the way you Ventus has any spot on formal on a possible takeover from Thailand businessman mr B offers a true boost to El Diablo's outraged fans. guess it wasn't all Allegri's fault, after all, change is coming fast but it's never fast enough and there's no guarantees in the crazy world of football. but put in you energized owner in place along with me, Abby Ancelotti and mal DD, and it could change a hell of a lot quicker for Milan. fans are restless. big time I'd bought Milan clubs. but changes on the horizon and it's needed to wake up Italy's great sleeping giants. right now it's inter, under a new start, showing their eternal rivals the way forward.","[('nobody', 'modesty'), ('football', 'structure'), ('Diablo', 'fans'), ('it', 'Allegri'), ('Allegri', 'fault'), ('change', 'it'), ('it', 'there'), ('there', 'guarantees'), ('it', 'Italy'), ('Italy', 'giants'), ('it', 'start')]","[[nobody, is, the, reduced, to, a, far, greater, modesty], [football, 's, very, structure], [Diablo, 's, outraged, fans], [it, was, n't, all, Allegri], [Allegri, 's, fault], [change, is, coming, fast, but, it], [it, 's, never, fast, enough, and, there], [there, 's, no, guarantees], [it, 's, needed, to, wake, up, Italy], [Italy, 's, great, sleeping, giants], [it, 's, inter, ,, under, a, new, start]]"
114,"human t no bear sempre, at young kiniro at 93, asked me: rear, what's your thoughts on your Ventus this season and hope in the ax, strengthened next season? well, the event is, have rebuilt supremely well, haven't there since the dark days of Cal Poly, and that was not long ago. in that short time they've showed the rest of italy the way forward and become the blueprint for every italian club. they're a really progressive club, both on the pitch and in the boardroom. the new stadium, the incredible shrewd player acquisitions, the harmonious club structure- it's all fueled unstoppable momentum with each passing season. now, how many clubs in world football can really say that? and they have done it without spending very much money. magnifico. they'll lose their excellent coach to the national team and they get better. extraordinario. this last win against monaco gives them one foot inside the Champions League semi-final, confirming that the Zebras escalation back to Europe's elite is taking place. you vs forward-thinking ambitions are getting paired, repaired over and over in an escalation of achievements, running away with the league in the cook fail and within touching distance of European glory. this is a wonderful period for the black and weights, but the diamond may not be forever, father. time will soon rob them. they great inspirations, keilor and Buffon. they may lose the dynamic feathers to his beloved boca juniors, and perhaps even Pogba, to a stinking rich club. how can they replace them? I don't know if they can. they've got a rich history of doing it before. but this will be monumental challenge, and that's for another day. forget about that. for now, they've got some fabulous young players coming through the system as well. for now, though, the run the cusp of a treble, and these are halcyon Diaz for the Bianconeri fanatical. so enjoy your vibrant team, their wonderful work, their dynamic attack and rock-solid Italian marble defense. your lady may be sitting in a rocking chair, but she here knitting any sweater, she's polishing a dagger.","[('what', 'your'), ('event', 'days'), ('it', 'all'), ('Europe', 'elite'), ('elite', 'place'), ('this', 'period'), ('that', 'day'), ('she', 'dagger')]","[[what, 's, your], [event, is, ,, have, rebuilt, supremely, well, ,, have, n't, there, since, the, dark, days], [it, 's, all], [Europe, 's, elite], [elite, is, taking, place], [this, is, a, wonderful, period], [that, 's, for, another, day], [she, 's, polishing, a, dagger]]"
115,"who's going to win La Liga? I'll tell him, no sort of. it's a coin toss between barcelona and real madrid, obviously. just 10 games left and both of these exceptional teams of massive distractions in the Champions League, hellacious battle royals are wearing vs psj and athletic, or get past them and it only gets harder. Plus, boss, i heard the Spanish Cup final awaiting them, with just four very bridgeable points separating them heading into today's games against Al Maria and Rio, the rear sister Taylor than a camel's bum in a sandstorm. pressures par for the course in both clubs, where pressure like a pair of carpet slippers, so pressure isn't an issue. both very healthy squads, now hard choices for the excellent cautious to deliberate over. in both Carlito and lucho have massage their lane up so wonderfully that they look very, very even. the star players are radiating more energy than a big bang and confidence is sky-high for loss plan cause. perhaps the reliability on the Portuguese number 7 is a little less than bosses reliance on yard in pain number 10. but if message that is best in any of the big hard games, all bets are off. he all as everything barsa, have veritable wars waiting for them at Sevilla, a wicked test that one, and later in the cauldron of the Calderon vs champions athletic, or possibly the Waterloo game that one surging, Valencia will play at camp nor. and the Bernabeu, to further complicate matters. well, los Blancos fears treacherous trips to cell death, severe, and both have got a visit espaol, who are capable of throwing their parakeets into the works, really dumping everything up. the Merengues have the advantage in the head-to-head if the end up tied at the wire, but I don't think it will be afford to finish. I think barsa will drop points on their tougher rounin and real madrid win out, but with one major provider. only if Messi's genius xfactor does not emerge- embosses acid test games- will there be celebrations at the sub Ellis. if it does law, the taps will floor i canna. let us no pressure there, leo.","[('who', 'La'), ('it', 'coin'), ('today', 'games'), ('camel', 'bum'), ('pressure', 'issue'), ('confidence', 'sky'), ('number', 'bosses'), ('that', 'any'), ('Messi', 'genius')]","[[who, 's, going, to, win, La], [it, 's, a, coin], [today, 's, games], [camel, 's, bum], [pressure, is, n't, an, issue], [confidence, is, sky], [number, 7, is, a, little, less, than, bosses], [that, is, best, in, any], [Messi, 's, genius]]"
116,"where do I read good mullah mayoralty me from the fall oddity or straight as theirs, as the most pure goalscorer of all time? re item number one: I don't think there has ever been, or there ever will be, one leg good, he was a unique player in his stale. he was a unique player within his teams that he played for. in reality he was a luxury type of forward. he didn't do much work outside of the box. he didn't come back in track, back on defense. we didn't want him to do that. but you put him in situations in save the box or a little bit outside the box, but primarily inside the penalty box, and he was the cleaner of cleaners, him. he had the geometry of the penalty box down to Archimedes standards, two isosceles, all the Greek geometries. they had the same types of angles in their heads. as good mall I did in his. you fed him the ball with a defender on him. he would be able to feel the defender spin in without looking to where the goalposts are. he would finish it off. for me is at the top of Mount Everest, stacked on top of Kilimanjaro. there was never, ever, a player that finished chances. Lake GERD Muller. he was a luxury in his own way because he didn't have to work much outside the box. he didn't do defensive duties, all he did was finished. he was a penalty box predator, a penalty box assassin, and he had his angles in that penalty box down better than isosceles. nobody could teach anything about good mullah how to finish, he was the king of all time. there will never be another one like do Obama.","[('he', 'player'), ('he', 'player'), ('he', 'luxury'), ('he', 'cleaner'), ('me', 'top'), ('there', 'player'), ('he', 'luxury'), ('he', 'penalty'), ('he', 'king')]","[[he, was, a, unique, player], [he, was, a, unique, player], [he, was, a, luxury], [he, was, the, cleaner], [me, is, at, the, top], [there, was, never, ,, ever, ,, a, player], [he, was, a, luxury], [he, was, a, penalty], [he, was, the, king]]"
117,"look, I'll put a heads soon. I'll be answering all of your questions right here on rear Hudson raw, every week. it can ask me anything you want, anything regarding me as a coach, as a player, as a commentator, as a fan, about Shakespeare, about mechanics, I don't care. ask me anything you want to know right here on bein sports, with rear hurts and raw.",[],[]
118,"the time bomb that is El Clasico is ticking. its countdown to zero is fast approaching and as eagerly anticipated as ever. and as football lovers around the world make preparation to put everything else aside for the Navy minute Armageddon, there's only one set of lonely eyes following a kickoff time with a lot more pressure and feeling of responsibility than any ballon d'or winner, then any world cup winner, any multi-million dollar superstar. his is an isolation, complicatedly holding everything together: fans, executives, all of their fear. it's the players. or between the lips of just one man when seeing George midst the dragon, when peppier reaches in to tackle niyama inside the penalty box, only one man matters. it's his decision that will change. wolves break, hearts are bursting with joy and we're referee on sunday is Antonio Miguel matheus lajas, a good man known as lajas the boss. just 38, he's reft. a match between mania Castle- you needed- and bored, or in 2012, when we beat the French. he's 3- nothing. how could you not love this orbiter? in the Roma Fiorentina game last week, signore lajas was both breathing fire at all 22 players in having a laugh with the lads, but always in game management mode. don't be too focused on the star dismay of the footballers on Sunday in the classic, or be concerned about that tiny piece of cork rattling around in the boss's whistle, that shrill blast. that can be the crucial needle point on which, where that game is gonna go, it can alter destiny. this is a brave, bald referee: imbue, liant and gnarly at the same time. he's got a personality as determining as a spirit level, but as reactionary as a t-rex with an itch that it can't reach. signore lajas, the universe is watching and you are at the center of it slowest.","[('that', 'El'), ('there', 'set'), ('his', 'isolation'), ('it', 'players'), ('it', 'his'), ('sunday', 'Antonio'), ('he', 'nothing'), ('lajas', 'fire'), ('boss', 'whistle'), ('game', 'it'), ('this', 'referee'), ('he', 'personality'), ('universe', 'you')]","[[that, is, El], [there, 's, only, one, set], [his, is, an, isolation], [it, 's, the, players], [it, 's, his], [sunday, is, Antonio], [he, 's, 3-, nothing], [lajas, was, both, breathing, fire], [boss, 's, whistle], [game, is, gon, na, go, ,, it], [this, is, a, brave, ,, bald, referee], [he, 's, got, a, personality], [universe, is, watching, and, you]]"
