,punctuated transcripts,sentences,nouns
62,"well, this week marks the halfway point of the qualifying campaign in South America. in terms of the table, the top five teams are all within three points of one another, and it is fairly tight even within the top seven. if you go there within five points of of one another for Argentina, they can go tops early, stay within a point of first place with a win in Lima, Edgardo bauza side or the late-game, so they'll know what's happening elsewhere when they take the pitch. the big question for our Jen Tina, though, Raymond, is who replaces Leonel Messi or, better yet, who fills that role? yeah, they've got some, they've got. there is no team in world football, in my opinion, but equipped then to compensate for the genius of messing, and I mean compensate. they'll never replace it. yeah, but they've got some great players to come in and it's the coach's decision. he's got two or three that he could pick from, including Messi. lights gonna start, could eat, that is also gonna start. so the question for him was: who was in now? who's gonna replace Messi? because he's irreplaceable and he's got a number of players who can fill that slot. but who was gonna replace Lucas Biglia? and the answer there was Matias. can TV there? who couldn't find the playing time at Atletico Madrid, so he was loaned out to Sevilla, where Jota have some Paulie, from where Chile manager is now starting to work him in. he gets rewarded now by Bowser to line up alongside machine. I know. the question here, though, is- or the issue here is- that Messi is so good at being that link up for Argentina. he drops back in, similar to what he does in that sort of Chhavi Iniesta role for Barcelona. he can do the Virgin Tina's will and be a playmaker. they don't have that right now. what they have, essentially, is six defenders and four Ford's, because you've got the four-man backline, the two defensive midfielders and then Egwene, dibala, agero and de maria. so who's going to link up that play? who's gonna find the fourth? I was about to say D Paulo, who does that? you fantasy can't draw back as well and help. it was lamelle, actually played in Messi's role against Venezuela, but I think they fuel it even less if they had their best strikers on the pitch at all times, and that's Egwene. that's Martin Carthy, who's the hottest rapper. it's a scandal, but he's still being kept out of the squad. this is the most ridiculous thing right now in well, right now. well, first of all, let me just say it was ever by Nega, who started in that game last time against uh in their last match of Mumbai, was terrible. he actually wore the number 10 on his back, which is a disgrace, because when I, that's not even he's not a- should be everywhere. that number 10 on his back at zero, George. here's the thing. Leno is gonna be important, but I think the man who should have the number terminus- DeMaria, I think to medium idea- is their best playmaker in the midfield in terms of assists outside of messy elope. they used to use him as part of three both day in the middle here present inside midfielder when he was at Real Madrid, so he can play that role. he's gonna have to deeper this time. which of those guys are there right now to get into the 11?","[('what', 'they'), ('Raymond', 'who'), ('there', 'team'), ('it', 'coach'), ('coach', 'decision'), ('he', 'that'), ('him', 'who'), ('who', 'Messi'), ('he', 'he'), ('he', 'number'), ('who', 'Lucas'), ('answer', 'Matias'), ('he', 'Sevilla'), ('manager', 'him'), ('Messi', 'Argentina'), ('Tina', 'will'), ('they', 'defenders'), ('Ford', 'you'), ('who', 'play'), ('who', 'fourth'), ('I', 'D'), ('it', 'Messi'), ('Messi', 'role'), ('that', 'Egwene'), ('that', 'Martin'), ('who', 'rapper'), ('it', 'scandal'), ('he', 'squad'), ('this', 'thing'), ('it', 'Nega'), ('which', 'disgrace'), ('that', 'he'), ('Leno', 'I'), ('idea-', 'their'), ('he', 'Real'), ('he', 'time')]","[[what, 's, happening, elsewhere, when, they], [Raymond, ,, is, who], [there, is, no, team], [it, 's, the, coach], [coach, 's, decision], [he, 's, got, two, or, three, that], [him, was, :, who], [who, 's, gon, na, replace, Messi], [he, 's, irreplaceable, and, he], [he, 's, got, a, number], [who, was, gon, na, replace, Lucas], [answer, there, was, Matias], [he, was, loaned, out, to, Sevilla], [manager, is, now, starting, to, work, him], [Messi, is, so, good, at, being, that, link, up, for, Argentina], [Tina, 's, will], [they, have, ,, essentially, ,, is, six, defenders], [Ford, 's, ,, because, you], [who, 's, going, to, link, up, that, play], [who, 's, gon, na, find, the, fourth], [I, was, about, to, say, D], [it, was, lamelle, ,, actually, played, in, Messi], [Messi, 's, role], [that, 's, Egwene], [that, 's, Martin], [who, 's, the, hottest, rapper], [it, 's, a, scandal], [he, 's, still, being, kept, out, of, the, squad], [this, is, the, most, ridiculous, thing], [it, was, ever, by, Nega], [which, is, a, disgrace], [that, 's, not, even, he], [Leno, is, gon, na, be, important, ,, but, I], [idea-, is, their], [he, was, at, Real], [he, 's, gon, na, have, to, deeper, this, time]]"
63,"Cristiano Ronaldo was an angry bird after being yanked off at Las Palmas upset, yes, but acknowledging his coach on his way to the bench. he did the same in his last game at Manchester United. the substitution door drew more headlines than dropping the points against a good last powerhouse. by the way, Zidane rotated half of his team and they played well, if not brilliantly, just like the rest of the games this season, when Bale, Murata, Benzema have all been substituted, but without incident or reaction, protecting a 2-1 lead, introducing fresh talent, while resting Ronaldo, who had been less than scalpel job. let's be fair, seen the right thing to do, bearing in mind two major factors. one, Real Madrid face a far tougher test in Dortmund, where Caesar will need his danger man at his brilliant best and - Ronaldo still working at his pinpoint sharpness. there's a big big difference between billion match fits, which Ronaldo looks like physically, and Gambier sharp, which he does not. yet that doesn't come in the gym or at the track or in the practice fields. the dark invaders look below par this season. after coming off a bad injury- and then he missed the entire preseason, cr7 had a few great opportunities to score in that last Palmas game. he was in exactly the right places to do damage, but lacked that trademark scalpel sharpness. he was typically committed the entire game. the runs, the availability, the athleticism all look great, but the Rivia touch not so much. hopefully it will return as he recovers his Tiger eye with each pm.","[('Ronaldo', 'bird'), ('there', 'difference'), ('he', 'places'), ('he', 'game')]","[[Ronaldo, was, an, angry, bird], [there, 's, a, big, big, difference], [he, was, in, exactly, the, right, places], [he, was, typically, committed, the, entire, game]]"
64,"real madrid's win / espaol showed the real value of top-class management and coaching. those who doubted zinedine zidane's credentials at the start of his coaching journey- and I was not one of those cynics- was sent away with their tail between their legs last season. forget the glitter around poster boys, BBC, and look past those headlines, Steelers, to find a real worth of Zidane. he added only players that had already been weaned at Real Madrid, bringing home asensio and Vasquez and Kiko Casilla and shrewdly board back murata from your vendors who wanted to keep him. but even more important than freshening up his squad has been the continued work during the working week on the sweatbox practice fields at val de bebes, where the real work goes on into getting things done right in the intimidating corridors of power at the santiago bernabu sedan has massaged power brokers as he has his players. he's calmed the waters and set a fire upon it. look at the performances of covetous Isco, hummus, Vasquez, Kiko. these are players down the pecking order, but they have won games for their coach. keeping Ronaldo, bill and benzema happy at the point of the pyramid is easy. it's what's beneath that point that's crucial, architect Zuzu. he's got all the angles covered right now, just like he did as a player. you.","[('madrid', 'win'), ('zidane', 'credentials'), ('I', 'those'), ('those', 'their'), ('he', 'waters'), ('it', 'what'), ('what', 'point'), ('that', 'architect'), ('he', 'angles')]","[[madrid, 's, win], [zidane, 's, credentials], [I, was, not, one, of, those], [those, cynics-, was, sent, away, with, their], [he, 's, calmed, the, waters], [it, 's, what], [what, 's, beneath, that, point], [that, 's, crucial, ,, architect], [he, 's, got, all, the, angles]]"
65,"it's often referred to as the beautiful game, this sport of hours- and I'm much like we saw on saturday between barcelona and Oliver's remaindered me why, here in tiny deportiva, Oliver's was a team that looked like liver to Barcelona's Dracula, a behemoth of a footballing shark against the min or the size of Attila. the fact that the brave hearts of Oliver's emerged victorious over illustrious barsa confirms once again that the beauty of this sport of ours isn't in what we know but what we do not. Isaac Newton said he was like a boy at the seashore, playing with pebbles and shells, whilst the great portion of truth Leah undiscovered before me. the great English scientist must have been a football fan. this fickle game of ours looks at us with an enigmatic Mona Lisa Lakes mail and says: you don't know me, you'll never know me. all of us, and Ricky Mourinho, Ferguson, why do you all are? they can't figure it out, so don't feel so bad. football's a paradox, an unsolvable mystery, a rolling ball of puzzles. every sport is this way: horse race and basketball, baseball, grid again. but our football is arguably the most mystifying. for instance, when Messi, Iniesta and Suarez vainly got onto the pitch. Barcelona, what worse. figure that one out. a creer supercomputer fans, analysts, experts, we don't know. what we saw on Saturday was irrational. a sports so ambiguous, this incomprehensible illusion of the beautiful game, the baffling him, you.","[('it', 'game'), ('Oliver', 'me'), ('Oliver', 'team'), ('Barcelona', 'Dracula'), ('Oliver', 'barsa'), ('ours', 'what'), ('he', 'boy'), ('football', 'paradox'), ('sport', 'way'), ('football', 'mystifying')]","[[it, 's, often, referred, to, as, the, beautiful, game], [Oliver, 's, remaindered, me], [Oliver, 's, was, a, team], [Barcelona, 's, Dracula], [Oliver, 's, emerged, victorious, over, illustrious, barsa], [ours, is, n't, in, what], [he, was, like, a, boy], [football, 's, a, paradox], [sport, is, this, way], [football, is, arguably, the, most, mystifying]]"
66,"the rise of the fancy shmancy machines took the very significant leap forward last week when video review was used in the italy france game in bari. a fifa video assistant referee of are actually two of them this time- monitored the action on HD teles in a van parked outside the stadium, far from the maddening crowd. anyway, it only took five minutes of player for the two VARs to put down their pizza and beer and pass on their advice to the referee on the pitch. a heavy challenge on de Rossi by sinabi had the Italians clamoring for a straight red card, protesting vehemently. but there were two greasy finger lives in the truck. they'll stare approval that the yellow card given by the ref was indeed the correct call. the Italians accepted the decision without any fuss. minutes later, another incident was reviewed by our bloodshot eye pepperoni buddies in the van when a de Rossi header hit the hand of a French defender in the penalty area. potential pk's and red cards. alte games became so. these reviewable situations could really help the ref get the rake, or only clear mistakes are being reviewed in these trail runs right now. but the digital genie is out of the digital bottle now and into the fancy shmancy machine. hey, if it keeps goalkeepers on the Alain during penalty kicks. that will do me good job. this video assistant referee gig footie, pizza and beer in a van down by the river.","[('review', 'italy'), ('ref', 'call'), ('incident', 'our'), ('pk', 'cards'), ('genie', 'bottle')]","[[review, was, used, in, the, italy], [ref, was, indeed, the, correct, call], [incident, was, reviewed, by, our], [pk, 's, and, red, cards], [genie, is, out, of, the, digital, bottle]]"
67,"in Sunday morning. problems in World Cup, famous from Aislin to South Africa. every weekend, everywhere there's a game where a referees call or not call for a penalty kick is the hot topic. we had one during the tremendous athletic club Barcelona match where my tio lajas, the referee, denied equal my nines Bilbao say the spot kick in the 89th minute. it was a battle royal of a match. Bilbao indefatigable in there, pressurizing embosser and the champions responding brilliantly. throughout the house was handing out yellow cards like speeding tickets, at the end e500. and then it happened. approached in the name earth minute, a tussle between finishes, man of the match, magnetics and iike moon, I mean, who looks like he's got a live lobster down his shorts here battling for possession just inside the penalty box. record it's Falls Linnaean has possession, the balls in front of him, even tries to desperately kick the ball away, but he kicks the standing legs of the Basque. nor contact with the ball. then Down Goes, Frazier. Down Goes, Frazier. 25 minutes earlier a foul is given for this. Denis Suarez doesn't even touch Benny at. the ref produced the yellow card to Sergio Busquets for protesting too vehemently and Luis Suarez for good measure. the world's gone mad, felt that. know about that green rule 12 in FIFA's laws of the game, sections three, four, five and six gone. do it now. that's your homework for this week, my peerless pay attention boy.","[('there', 'game'), ('kick', 'topic'), ('it', 'battle'), ('house', 'cards'), ('he', 'lobster'), ('it', 'Falls'), ('foul', 'this'), ('world', 'that'), ('FIFA', 'laws'), ('that', 'your')]","[[there, 's, a, game], [kick, is, the, hot, topic], [it, was, a, battle], [house, was, handing, out, yellow, cards], [he, 's, got, a, live, lobster], [it, 's, Falls], [foul, is, given, for, this], [world, 's, gone, mad, ,, felt, that], [FIFA, 's, laws], [that, 's, your]]"
68,"Mario in sac asked me: read: what do you think of Thomas Rodriguez? possibly leave in real Madrid? when Sergio Aramis scored that last-second, last-gasp equaliser against Sevilla in that pulsating European Super Cup, it was all too familiar. here was a big tank player score in a big tangle that led to the Royal weights winning another european crown. a player that entered into the match, though, when real madrid was struggling and losing 2-1 with hamas rodriguez, and at the final whistle, Thomas could claim another medal to add to his collection. Los Blancos winning the game 3-2. sit down. it seems has enough faith in the ex and regarded colombian to help turning a game around, but it doesn't seem these days that he has enough trust to give him a starting position in the side. this major competition in this team- nail for hummus, moderate cross Kovacic and now the impressive marker- was sensual and Lukas Vasquez. Thomas has had a lots of problems at the club of late: speedin in his LDR e it- and that's forgivable if you know anything about that car- but also arguments with the coaches and Madrid hierarchy about postponing surgery on his wonky shoulder. listen, this is a big ticket, big talented footballer whose dream it was the clear for the Merengues, but the 18 million euros Florentino splashed out for him requires more. his ability is unquestioned. I'll love him as a footballer and I think Zidane rates and highly, but not enough. seemingly it's probably best right now for a parting of the ways Thomas's reputation is spiraling downwards. but there's still lots of great clubs in Europe very interested, but not at the big asking price of 80 million euros. he's just 25 in a truly tremendous talent that could add vision, poise, Pearce and creativity to any club, but not real Madrid. it's been way too long since we saw that consistently impressive performances from hammers, like we did in the World Cup, and Carlo Ancelotti: we shine like a diamond. he was superb, but those memories are fading faster than a rainbow. Hamas's true love is real Madrid, but some love stories end with tears and a journey.","[('madrid', 'hamas'), ('marker-', 'Lukas'), ('that', 'you'), ('this', 'ticket'), ('it', 'Merengues'), ('it', 'parting'), ('Thomas', 'reputation'), ('reputation', 'downwards'), ('there', 'lots'), ('he', 'talent'), ('it', 'we'), ('he', 'memories'), ('Hamas', 'love'), ('love', 'Madrid')]","[[madrid, was, struggling, and, losing, 2, -, 1, with, hamas], [marker-, was, sensual, and, Lukas], [that, 's, forgivable, if, you], [this, is, a, big, ticket], [it, was, the, clear, for, the, Merengues], [it, 's, probably, best, right, now, for, a, parting], [Thomas, 's, reputation], [reputation, is, spiraling, downwards], [there, 's, still, lots], [he, 's, just, 25, in, a, truly, tremendous, talent], [it, 's, been, way, too, long, since, we], [he, was, superb, ,, but, those, memories], [Hamas, 's, true, love], [love, is, real, Madrid]]"
69,"Tim asked me, Rick, who's got the toughest start of the season? in this Twilight Zone period of preseason football and transfer hurly-burly, it's been pretty slim pickings in the rear Hudson raw meal bag. this week I got dozens of people asking me about Paul Pogba's transfer, but I'm as tired as a one-legged man in a butt-kicking contest talking about flipping Paul Pogba. so who's got the toughest start of this season? in France, PSG, who have looked ominously good in preseason, fierce up the basket, and monaco on the road during their first three games. them core chickens are tough and then principal Italians are good. so then maybe a slip up there, but new bar soon. I Emery looks like he's actually got the Parisians playing slicker and quicker and better than a riverboat gambler with a stacked deck. in Syria, indomitable Juventus have a similarly worrisome set of openers. face in a very good fiorentino at home- hungry lats, you aware, sassy wall. or at Turin, and then Indonesian ally in Milan, but the Emir's insane ins. the zebras have made looks to have them set for a bottle rocket start on late last season, which the LT measures not to repeat. so they'll be as prepared as a redneck at a Donald Trump rally in spam can be honest. Barcelona fiercer, not so taxing visit from real betis and ghostpoet for his managerial debut in la liga. good, look there go slap. but then, boss, I get on there. Bush, the Basque Country and athletic club, who blissfully remember the for naught and hammering, delivered a message man in the Copa del Rio last season. then they visit gijn, in celta vigo, where they got stuffed like a turkey on Thanksgiving for one last season. then diego simeone e is Atleti marching to Camp Nou. so it's a bit of a tricky, dicky set of early matches for barsa. already, al Madrid have an early tightrope to walk at anna wetter, where sociedad are always up for the big glamour boys, and then lost Blancos have to winnable games at the White House against celta and you come as a shock una. the Merengues could be the early liga leaders. so I see barsa having the most challenging opening chapter. the beginning is a very delicate place to start. beautiful words, them, get ready.","[('who', 'start'), ('it', 'pickings'), ('Pogba', 'transfer'), ('who', 'start'), ('he', 'Parisians'), ('Emir', 'insane'), ('e', 'Atleti'), ('it', 'bit'), ('beginning', 'place')]","[[who, 's, got, the, toughest, start], [it, 's, been, pretty, slim, pickings], [Pogba, 's, transfer], [who, 's, got, the, toughest, start], [he, 's, actually, got, the, Parisians], [Emir, 's, insane], [e, is, Atleti], [it, 's, a, bit], [beginning, is, a, very, delicate, place]]"
70,"jose de la cruz a smeary. what's your prediction for Newcastle season in the championship? England's championship season kicks off this. Brady on bein sports. when Fulham take on a team that is a red-hot favourite to be, can't be honest. I can be honest. and that team is newcastle united and on Freddie, they take their first step towards getting back to the hallowed ground of the APL. you castle are the tune, as they are affectionately known, and Tyneside are less than two-to-one favorites to be crowned champs. the closest after that is Norwich City, a tender one. maybe cartoon is a better description of those odds. they're Looney Tunes. superstar coach Rafa Benitez has the city and jordy army full of belief with their legendary fan support, wealth and talent. the optimism is understandable. Rafa goes from coaching Cristiano Ronaldo to Jonjo Shelvey. but the expectations thats in james's park are as high as a hippie at Woodstock and they are justifiable favorites. but there are no certainties. Aston Villa were relegated with Newcastle in. this. big club who was won the European Cup, are in desperate need of rejuvenation from you, boss Timoteo, in their new owner. but I see the villains struggling this year. Derby County have a rich history and their past as well. they've got a good-looking squad and you leader Nigel Pearson, who demand every drop of effort every day. norwich city also expect automatic promotion after taking the drop last season. manager Alex Neil is another dynamic boss. the Pearson appointment will be really interesting though. brighton and hove albion have a good man, a really good coaching, chris hughton, who came this close to promotion last season in a hard break in playoff loss, and they'll look to turn that disappointment in inspiration. this go-around listen. it should be a tremendous Championship rias all season long, with the birds leading the way in this order, Magpies, Canaries and seagulls with a ram in an L close by may. dark horses are Apes which in Leeds, but everyone should be pulling for tiny Burton Albion to survive her, where the lads can be honest under Rafa Benitez, I hope S the S sin James's Park.","[('what', 'your'), ('England', 'championship'), ('that', 'favourite'), ('team', 'newcastle'), ('that', 'Norwich'), ('cartoon', 'description'), ('james', 'park'), ('who', 'European'), ('Neil', 'boss'), ('James', 'Park')]","[[what, 's, your], [England, 's, championship], [that, is, a, red, -, hot, favourite], [team, is, newcastle], [that, is, Norwich], [cartoon, is, a, better, description], [james, 's, park], [who, was, won, the, European], [Neil, is, another, dynamic, boss], [James, 's, Park]]"
71,"mr cheeks cost that tag and a good few with us askme: agree what's happening in this area? transfer saga involving Pogba egg, why he and Napoli? well, not only weird for two of the biggest transfer bombshells to be dropped- Paul Pogba to Manion Aiden, Gonzalo Higuain to you, ventus may? good friend Tancredi Palmeri tells me they're done deals ray. I believe anything Tancredi tells me. if he told me to see if the pet of Port, your pain, i believe him. your vendors will make as much money on this transfer with save we're just taken into account, then what it cost them a bill. they're magnificent stadium, think about that. but such as the Zebras ambition, they're going to sink nearly all of that money into Nye. they already saying p a notch, benattia piazza and dani lvarez. so it looks like it's going to be champions league or bust for the grid. bracken weights from chilean. Napoli's president de laurentiis is a shrewd businessman who doubled his money from the higway in seal, but he's gotta replace a player who had a spectacular season unlike ever before in his career. replacing one great player with four excellent young players should be the way to go for Napoli. how about this saying in Daniel ruga, Annie from UV with the impressive creation, Marco rogue to strengthen the Neapolitan defense, and Gabi Barbosa from Santos upfront, or maybe even Carlos bacca is a shorter term replacement, and they won't have to justify gargantuan over inflated price tags that will hang around pagas and egg Wahines necks. hey, Napoli, I bet you could even get a knockdown price on mario balotelli. bet you're sorry and whip them into shape.","[('what', 'area'), ('it', 'champions'), ('Napoli', 'president'), ('laurentiis', 'businessman'), ('he', 'player'), ('bacca', 'term')]","[[what, 's, happening, in, this, area], [it, 's, going, to, be, champions], [Napoli, 's, president], [laurentiis, is, a, shrewd, businessman], [he, 's, got, ta, replace, a, player], [bacca, is, a, shorter, term]]"
